SKU,name,description,price,meta_description,meta_keywords,tax_category_id,shipping_category_id,count_on_hand,product_properties,taxons,blendable_taxon_ids,images
"TOCNN-0003","Fujian Oolong Loose Leaf Tea","<h3>Description</h3> <p>A basic toasty oolong with an open leaf with some stems.   UniqTeas Fujian Oolong Loose Leaf Tea is a wonderful oolong tea.  UniqTeas.com is a great place to shop for tea and buy tea and tea accessories.</p><h3>Ingredients</h3> <p>Oolong tea.</p>","9.75","Select Fujian Oolong Loose Leaf Tea and other China oolong teas at UniqTeas.com for all of your loose tea, tea sachet, tea bag and tea accessory needs.","Oolong Tea,Fujian Oolong Loose Leaf Tea,China","698318840","727197546","20000","","Categories>China>Oolong Tea","",""
"TOVNN-0007","Peach Oolong Loose Leaf Tea","<h3>Description</h3> <p>Specially selected Formosa oolong teas, naturally flavored with peach pieces to underline the peach aroma of the oolong.   UniqTeas Peach Oolong Loose Leaf Tea is a wonderful oolong tea.  UniqTeas.com is a great place to shop for tea and buy tea and tea accessories.</p><h3>Ingredients</h3> <p>A Formosa oolong with peach pieces and peach flavor.</p>","21.75","Select Peach Oolong Loose Leaf Tea and other Taiwan oolong teas at UniqTeas.com for all of your loose tea, tea sachet, tea bag and tea accessory needs.","Oolong Tea,Peach Oolong Loose Leaf Tea,Taiwan","698318840","727197546","20000","","Categories>Taiwan","",""
"TOCNN-0008","Ti-Kwan-Yin Oolong Loose Leaf Tea","<h3>Description</h3> <p>Lightly oxidized, steeps light green liquor, slightly nutty flavor, light aroma with hints of fruit   UniqTeas Ti-Kwan-Yin Oolong Loose Leaf Tea is a wonderful oolong tea.  UniqTeas.com is a great place to shop for tea and buy tea and tea accessories.</p><h3>Ingredients</h3> <p>Oolong tea.</p>","18.75","Select Ti-Kwan-Yin Oolong Loose Leaf Tea and other Taiwan oolong teas at UniqTeas.com for all of your loose tea, tea sachet, tea bag and tea accessory needs.","Oolong Tea,Ti-Kwan-Yin Oolong Loose Leaf Tea,Taiwan","698318840","727197546","20000","","Categories>Taiwan","",""
"TOTON-0009","Tung Ting Taiwanese Oolong Loose Leaf Tea","<h3>Description</h3> <p>Most famous of the Taiwanese oolongs from the mountain of the same name. fresh and aromatic liquor with a high viscosity, a tone of coconut and bright lilac perfume   UniqTeas Tung Ting Taiwanese Oolong Loose Leaf Tea is a wonderful oolong tea.  UniqTeas.com is a great place to shop for tea and buy tea and tea accessories.</p><h3>Ingredients</h3> <p>Taiwanese oolong tea.</p>","54","Select Tung Ting Taiwanese Oolong Loose Leaf Tea and other Taiwan oolong teas at UniqTeas.com for all of your loose tea, tea sachet, tea bag and tea accessory needs.","Oolong Tea,Tung Ting Taiwanese Oolong Loose Leaf Tea,Taiwan","698318840","727197546","20000","","Categories>Taiwan","",""
"TOTNN-0010","White Tip Oolong Bai Hao Loose Leaf Tea","<h3>Description</h3> <p>This oriental beauty is one of the finest of the white-tipped oolongs. Peachy aroma and wonderful sweet taste.   UniqTeas White Tip Oolong Bai Hao Loose Leaf Tea is a wonderful oolong tea.  UniqTeas.com is a great place to shop for tea and buy tea and tea accessories.</p><h3>Ingredients</h3> <p>White tipped Oolong tea.</p>","55.5","Select White Tip Oolong Bai Hao Loose Leaf Tea and other China oolong teas at UniqTeas.com for all of your loose tea, tea sachet, tea bag and tea accessory needs.","Oolong Tea,White Tip Oolong Bai Hao Loose Leaf Tea,China","698318840","727197546","20000","","Categories>China>Oolong Tea","",""
"TOTNN-0011","Passionfruit Oolong Loose Leaf Tea","<h3>Description</h3> <p>A delicious flavored Oolong tea with passionfruit pieces and passionfruit flavoring.  Delicious.  UniqTeas Passionfruit Oolong Loose Leaf Tea is a wonderful oolong tea.  UniqTeas.com is a great place to shop for tea and buy tea and tea accessories.</p><h3>Ingredients</h3> <p>Oolong Tea, marigold petals with passion fruit flavor</p>","25.5","Select Passionfruit Oolong Loose Leaf Tea and other Taiwan oolong teas at UniqTeas.com for all of your loose tea, tea sachet, tea bag and tea accessory needs.","Oolong Tea,Passionfruit Oolong Loose Leaf Tea,Taiwan","698318840","727197546","20000","","Categories>Taiwan","",""
"TRCON-0001","Rooibos Vanilla Loose Leaf Tea","<h3>Description</h3> <p>Sweet and nutty Rooibos combined with the succulence of a bourbon vanilla.  Such a great tea.  UniqTeas Rooibos Vanilla Loose Leaf Tea is a wonderful rooibos tea.  UniqTeas.com is a great place to shop for tea and buy tea and tea accessories.</p><h3>Ingredients</h3> <p>Honey bush with vanilla/</p>","16.5","Select Rooibos Vanilla Loose Leaf Tea and other vanilla rooibos teas at UniqTeas.com for all of your loose tea, tea sachet, tea bag and tea accessory needs.","Rooibos Tea,Rooibos Vanilla Loose Leaf Tea,vanilla","698318840","727197546","20000","","Categories>Flavored Tea> Flavored Herbal Tea","",""
"TRANN-0002","Orange Creamsicle Loose Leaf Tea","<h3>Description</h3> <p>A sweet cup, with notes of orange creamsicle ice cream this Rooibos tea is delectable.  With the fragrance of tangy oranges blended with  creamy vanilla, it has quickly become a popular favorite.  UniqTeas Orange Creamsicle Loose Leaf Tea is a wonderful rooibos tea.  UniqTeas.com is a great place to shop for tea and buy tea and tea accessories.</p><h3>Ingredients</h3> <p>Rooibos, cornflowers, and blue mallow flowers with vanilla and orange flavor. </p>","16.5","Select Orange Creamsicle Loose Leaf Tea and other orange rooibos teas at UniqTeas.com for all of your loose tea, tea sachet, tea bag and tea accessory needs.","Rooibos Tea,Orange Creamsicle Loose Leaf Tea,orange","698318840","727197546","20000","Sweetness:4|Fruity:3|Nutty:0|Vegetal:0|Woody:0|Aroma:4|Spicy:0|Floral: 0|Strength:4","Categories>Flavored Tea> Flavored Herbal Tea","",""
"TRCNN-0003","Honeybush Loose Leaf Tea","<h3>Description</h3> <p>Grown in south Africa (not to be confused with rooibos), this tea has a naturally sweet, unique, earthy taste, and calms the central nervous system. a stress reliever and all-around soother   UniqTeas Honeybush Loose Leaf Tea is a wonderful rooibos tea.  UniqTeas.com is a great place to shop for tea and buy tea and tea accessories.</p><h3>Ingredients</h3> <p>Organic Honey bush</p>","16.5","Select Honeybush Loose Leaf Tea and other african rooibos teas at UniqTeas.com for all of your loose tea, tea sachet, tea bag and tea accessory needs.","Rooibos Tea,Honeybush Loose Leaf Tea,african","698318840","727197546","20000","","Categories>Flavored Tea> Flavored Herbal Tea","",""
"TRCON-0004","Rooibos Loose Leaf Tea","<h3>Description</h3> <p>Grown in south Africa, rooibos is a flavorful alternative for those seeking to minimize their caffeine intake. health benefits include: antioxidant properties; relieves stomach ulcers, nausea, constipation, and heartburn; high levels of calcium, manganese, magnesium, potassium, copper, and fluoride; increases absorption of iron in the body. do we need to go on?   UniqTeas Rooibos Loose Leaf Tea is a wonderful rooibos tea.  UniqTeas.com is a great place to shop for tea and buy tea and tea accessories.</p><h3>Ingredients</h3> <p>Organic Rooibos</p>","12.75","Select Rooibos Loose Leaf Tea and other african rooibos teas at UniqTeas.com for all of your loose tea, tea sachet, tea bag and tea accessory needs.","Rooibos Tea,Rooibos Loose Leaf Tea,african","698318840","727197546","20000","","Categories>Africa","",""
"TRANN-0005","Pumpkin Cream Loose Leaf Tea","<h3>Description</h3> <p>How do we make our pumpkin cream so creamy? We start with the briskness of red roobis, mix in a little vanilla, and top it off with sweet pumpkin.  UniqTeas Pumpkin Cream Loose Leaf Tea is a wonderful rooibos tea.  UniqTeas.com is a great place to shop for tea and buy tea and tea accessories.</p><h3>Ingredients</h3> <p>Rooibos Tea with Pumpkin pieces and pumpkin flavoring.</p>","15.75","Select Pumpkin Cream Loose Leaf Tea and other pumpkin rooibos teas at UniqTeas.com for all of your loose tea, tea sachet, tea bag and tea accessory needs.","Rooibos Tea,Pumpkin Cream Loose Leaf Tea,pumpkin","698318840","727197546","20000","","Categories>Flavored Tea> Flavored Herbal Tea","",""
"TRANN-0006","Red Chai Spice Loose Leaf Tea","<h3>Description</h3> <p>Like Chai?  You’ll love our Rooibis Chai.  Add a little milk two cubes of sugar and you got a real treat.  Yum!  UniqTeas Red Chai Spice Loose Leaf Tea is a wonderful rooibos tea.  UniqTeas.com is a great place to shop for tea and buy tea and tea accessories.</p><h3>Ingredients</h3> <p>African Rooibos with cinnamon, ginger, cardamon, and vanilla.</p>","13.5","Select Red Chai Spice Loose Leaf Tea and other chai rooibos teas at UniqTeas.com for all of your loose tea, tea sachet, tea bag and tea accessory needs.","Rooibos Tea,Red Chai Spice Loose Leaf Tea,chai","698318840","727197546","20000","Sweetness:3|Fruity:0|Nutty:0|Vegetal:0|Woody:0|Aroma:4|Spicy:0|Floral: 0|Strength:4","Categories>Flavored Tea> Flavored Herbal Tea","",""
"TRANN-0007","Rooibos Colada Loose Leaf Tea","<h3>Description</h3> <p>Visions of your next island getaway will fill you mind when you smell the sweet aroma of this delicious Rooibos tea. A mouthwatering blend of ripe pineapple, succulent coconut, paired with a fine Rooibos tea. You'll feel the ocean breeze once you take a sip.   UniqTeas Rooibos Colada Loose Leaf Tea is a wonderful rooibos tea.  UniqTeas.com is a great place to shop for tea and buy tea and tea accessories.</p><h3>Ingredients</h3> <p>Rooibos and shredded coconut with pineapple, coconut, and vanilla flavor. </p>","16.5","Select Rooibos Colada Loose Leaf Tea and other tropical rooibos teas at UniqTeas.com for all of your loose tea, tea sachet, tea bag and tea accessory needs.","Rooibos Tea,Rooibos Colada Loose Leaf Tea,tropical","698318840","727197546","20000","Sweetness:4|Fruity:3|Nutty:2|Vegetal:0|Woody:0|Aroma:4|Spicy:0|Floral: 0|Strength:4","Categories>Flavored Tea> Flavored Herbal Tea","",""
"TRANN-0008","Nutty Rum Honeybush Loose Leaf Tea","<h3>Description</h3> <p>This green rooibos blend tastes just like a spiked punch you'd get wisking over the open seas on a Carribean catamaran just without the spike.  Oh course, you can add your own.  Fresh mango pieces, juicy papaya bits, rose petals, and a splash of passion fruit.  Yum!  UniqTeas Nutty Rum Honeybush Loose Leaf Tea is a wonderful rooibos tea.  UniqTeas.com is a great place to shop for tea and buy tea and tea accessories.</p><h3>Ingredients</h3> <p>Honeybush, almonds, safflowers, almond, macadamia nut and rum flavoring.</p>","16.5","Select Nutty Rum Honeybush Loose Leaf Tea and other rum rooibos teas at UniqTeas.com for all of your loose tea, tea sachet, tea bag and tea accessory needs.","Rooibos Tea,Nutty Rum Honeybush Loose Leaf Tea,rum","698318840","727197546","20000","","Categories>Flavored Tea> Flavored Herbal Tea","",""
"TRANN-0009","Carribean Punch Loose Leaf Tea","<h3>Description</h3> <p>Punch. This tastes like a tropical or Caribbean punch. Ingredients: Green Rooibos, mango, papaya bits, orange peel, rose petals and mango, passion fruit and papaya flavor.  UniqTeas Carribean Punch Loose Leaf Tea is a wonderful rooibos tea.  UniqTeas.com is a great place to shop for tea and buy tea and tea accessories.</p><h3>Ingredients</h3> <p>Green Rooibos, mango, papaya bits, orange peel, rose petals and mango, passion fruit and papaya flavor.</p>","18","Select Carribean Punch Loose Leaf Tea and other tropical rooibos teas at UniqTeas.com for all of your loose tea, tea sachet, tea bag and tea accessory needs.","Rooibos Tea,Carribean Punch Loose Leaf Tea,tropical","698318840","727197546","20000","Sweetness:4|Fruity:5|Nutty:0|Vegetal:0|Woody:0|Aroma:4|Spicy:0|Floral: 0|Strength:3","Categories>Flavored Tea> Flavored Herbal Tea","",""
"TWCNN-0001","Drum Mountain White Cloud Loose Leaf Tea","<h3>Description</h3> <p>This white tea is grown on the famous mountain top where the monks of the historic Buddhist drum mountain monastery grew their teas for centuries. easy to drink with a sweet, fragrant, slightly nutty flavor   UniqTeas Drum Mountain White Cloud Loose Leaf Tea is a wonderful white tea.  UniqTeas.com is a great place to shop for tea and buy tea and tea accessories.</p><h3>Ingredients</h3> <p>White tea from Fuji.</p>","28.5","Select Drum Mountain White Cloud Loose Leaf Tea and other Chinese white teas at UniqTeas.com for all of your loose tea, tea sachet, tea bag and tea accessory needs.","White Tea,Drum Mountain White Cloud Loose Leaf Tea,Chinese","698318840","727197546","20000","","Categories>China>White Tea","",""
"TWCON-0002","Pai Mu Tan White Peony Loose Leaf Tea","<h3>Description</h3> <p>The white peony is made from the buds and leaves that remain after the famous silver needle has been harvested. while the cup color is darker and the aroma bolder, the sweetness clearly identifies the relationship to the silver needle   UniqTeas Pai Mu Tan White Peony Loose Leaf Tea is a wonderful white tea.  UniqTeas.com is a great place to shop for tea and buy tea and tea accessories.</p><h3>Ingredients</h3> <p>Organic Pai Mu Tan white tea.</p>","18.75","Select Pai Mu Tan White Peony Loose Leaf Tea and other Chinese white teas at UniqTeas.com for all of your loose tea, tea sachet, tea bag and tea accessory needs.","White Tea,Pai Mu Tan White Peony Loose Leaf Tea,Chinese","698318840","727197546","20000","Sweetness:1|Fruity:0|Nutty:0|Vegetal:1|Woody:0|Aroma:0|Spicy:0|Floral: 0|Strength:2","Categories>China>White Tea","",""
"TWCNN-0004","White Currant Loose Leaf Tea","<h3>Description</h3> <p>Juicy aromatic currants paired with the delicacy of white tea leaves delivers a smooth flavor profile with a deeply fruity finish. There's a lot of flavor is this healthy white tea.   UniqTeas White Currant Loose Leaf Tea is a wonderful white tea.  UniqTeas.com is a great place to shop for tea and buy tea and tea accessories.</p><h3>Ingredients</h3> <p>China Pai Mu Tan, China Cui Min, rose hip peel, freeze-dried blackcurrants, flavoring, mallow blossoms, cornflower blossoms.</p>","21.2","Select White Currant Loose Leaf Tea and other Chinese white teas at UniqTeas.com for all of your loose tea, tea sachet, tea bag and tea accessory needs.","White Tea,White Currant Loose Leaf Tea,Chinese","698318840","727197546","20000","Sweetness:2|Fruity:0|Nutty:0|Vegetal:1|Woody:0|Aroma:3|Spicy:0|Floral: 0|Strength:2","Categories>Flavored Tea> Flavored White Tea","",""
"TWANN-0005","White Orange Ginger Peach Loose Leaf Tea","<h3>Description</h3> <p>Bai Mu Dan white tea, ginger root, orange peel, peach pieces, marigolds, safflowers and ginger orange peach flavor.   UniqTeas White Orange Ginger Peach Loose Leaf Tea is a wonderful white tea.  UniqTeas.com is a great place to shop for tea and buy tea and tea accessories.</p><h3>Ingredients</h3> <p>Bai Mu Dan white tea, ginger root, orange peel, peach pieces, marigolds, safflowers and ginger orange peach flavor. </p>","24.75","Select White Orange Ginger Peach Loose Leaf Tea and other Chinese white teas at UniqTeas.com for all of your loose tea, tea sachet, tea bag and tea accessory needs.","White Tea,White Orange Ginger Peach Loose Leaf Tea,Chinese","698318840","727197546","20000","Sweetness:3|Fruity:3|Nutty:0|Vegetal:1|Woody:0|Aroma:3|Spicy:0|Floral: 0|Strength:2","Categories>Flavored Tea> Flavored White Tea","",""
"TWANN-0006","White Peony Fruits Loose Leaf Tea","<h3>Description</h3> <p>Bai Mu Dan white tea blended with safflowers, ripe cherries, tangy cranberries and red berry flavor make this tea yummy.  UniqTeas White Peony Fruits Loose Leaf Tea is a wonderful white tea.  UniqTeas.com is a great place to shop for tea and buy tea and tea accessories.</p><h3>Ingredients</h3> <p>Bai Mu Dan white tea blended with safflowers, ripe cherries, tangy cranberries and red berry flavor make this tea yummy.</p>","24.75","Select White Peony Fruits Loose Leaf Tea and other Chinese white teas at UniqTeas.com for all of your loose tea, tea sachet, tea bag and tea accessory needs.","White Tea,White Peony Fruits Loose Leaf Tea,Chinese","698318840","727197546","20000","","Categories>Flavored Tea> Flavored White Tea","",""
"TWANN-0007","Champagne Raspberry White Loose Leaf Tea","<h3>Description</h3> <p>Like the taste of Champagne and Raspberry? Well you are going to love this tea. This romantic blend makes you feel like its Valentines day every day. Ingredients: White tea, safflowers with champagne flavor and red raspberry flavors.  UniqTeas Champagne Raspberry White Loose Leaf Tea is a wonderful white tea.  UniqTeas.com is a great place to shop for tea and buy tea and tea accessories.</p><h3>Ingredients</h3> <p>White tea, safflowers with champagne</p>","28.5","Select Champagne Raspberry White Loose Leaf Tea and other Chinese white teas at UniqTeas.com for all of your loose tea, tea sachet, tea bag and tea accessory needs.","White Tea,Champagne Raspberry White Loose Leaf Tea,Chinese","698318840","727197546","20000","","Categories>Flavored Tea> Flavored White Tea","",""
"TWANN-0008","Acai Berry White Loose Leaf Tea","<h3>Description</h3> <p>Delicious and good for you. This loose leaf white tea blend features “super food” acai mixed delicately with exotic, flavorful berries to create a deliciously flavorful white tea blend packed with antioxidants.   UniqTeas Acai Berry White Loose Leaf Tea is a wonderful white tea.  UniqTeas.com is a great place to shop for tea and buy tea and tea accessories.</p><h3>Ingredients</h3> <p>White tea scented with natural Acai berry and sprinkled with blue corn flowers. </p>","24.75","Select Acai Berry White Loose Leaf Tea and other Chinese white teas at UniqTeas.com for all of your loose tea, tea sachet, tea bag and tea accessory needs.","White Tea,Acai Berry White Loose Leaf Tea,Chinese","698318840","727197546","20000","Sweetness:3|Fruity:3|Nutty:0|Vegetal:1|Woody:0|Aroma:3|Spicy:0|Floral: 0|Strength:2","Categories>Flavored Tea> Flavored White Tea","",""
"TWANN-0009","Pomegranate White Loose Leaf Tea","<h3>Description</h3> <p>The sweet and tart taste of pomegranate combines with our white tea. This fruity blend seems to liven this otherwise serene white tea. Ingredients: Bai Mu Dan white tea, pomegranate peels, safflowers and pomegranate flavor.  UniqTeas Pomegranate White Loose Leaf Tea is a wonderful white tea.  UniqTeas.com is a great place to shop for tea and buy tea and tea accessories.</p><h3>Ingredients</h3> <p>Bai Mu Dan white tea, pomegranate peels, safflowers and pomegranate flavor. </p>","24.75","Select Pomegranate White Loose Leaf Tea and other Chinese white teas at UniqTeas.com for all of your loose tea, tea sachet, tea bag and tea accessory needs.","White Tea,Pomegranate White Loose Leaf Tea,Chinese","698318840","727197546","20000","Sweetness:3|Fruity:3|Nutty:0|Vegetal:1|Woody:0|Aroma:3|Spicy:0|Floral: 0|Strength:2","Categories>Flavored Tea> Flavored White Tea","",""
"TWANN-0010","White Chai Loose Leaf Tea","<h3>Description</h3> <p>Bai Mu Dan white tea, lemon grass, cardamom, cinnamon, and fresh ginger flavor. An absolute delight!   UniqTeas White Chai Loose Leaf Tea is a wonderful white tea.  UniqTeas.com is a great place to shop for tea and buy tea and tea accessories.</p><h3>Ingredients</h3> <p>Bai Mu Dan white tea, lemon grass, cardamom, cinnamon, and fresh ginger flavor.</p>","29.25","Select White Chai Loose Leaf Tea and other Chinese white teas at UniqTeas.com for all of your loose tea, tea sachet, tea bag and tea accessory needs.","White Tea,White Chai Loose Leaf Tea,Chinese","698318840","727197546","20000","Sweetness:2|Fruity:0|Nutty:0|Vegetal:1|Woody:0|Aroma:4|Spicy:4|Floral: 0|Strength:2","Categories>Flavored Tea> Flavored White Tea","",""
"TWANN-0011","White Christmas Loose Leaf Tea","<h3>Description</h3> <p>Bai Mu Dan white tea, orange peel, almonds, rose petals, cinnamon chips, apple pieces and cinnamon orange spice holiday flavor   UniqTeas White Christmas Loose Leaf Tea is a wonderful white tea.  UniqTeas.com is a great place to shop for tea and buy tea and tea accessories.</p><h3>Ingredients</h3> <p>Bai Mu Dan white tea, orange peel, almonds, rose petals, cinnamon chips, apple pieces and cinnamon orange spice holiday flavor </p>","24.75","Select White Christmas Loose Leaf Tea and other Chinese white teas at UniqTeas.com for all of your loose tea, tea sachet, tea bag and tea accessory needs.","White Tea,White Christmas Loose Leaf Tea,Chinese","698318840","727197546","20000","Sweetness:3|Fruity:2|Nutty:3|Vegetal:1|Woody:0|Aroma:4|Spicy:3|Floral: 0|Strength:2","Categories>Flavored Tea> Flavored White Tea","",""
"TWANN-0012","Tropical Hurricane Loose Leaf Tea","<h3>Description</h3> <p>Bai Mu Dan white tea, safflowers, blue mallow blossoms, marigolds, corn flowers and mango, passion tropical flavor.   UniqTeas Tropical Hurricane Loose Leaf Tea is a wonderful white tea.  UniqTeas.com is a great place to shop for tea and buy tea and tea accessories.</p><h3>Ingredients</h3> <p>Bai Mu Dan white tea, safflowers, blue mallow blossoms, marigolds, corn flowers and mango, passion tropical flavor. </p>","24.75","Select Tropical Hurricane Loose Leaf Tea and other Chinese white teas at UniqTeas.com for all of your loose tea, tea sachet, tea bag and tea accessory needs.","White Tea,Tropical Hurricane Loose Leaf Tea,Chinese","698318840","727197546","20000","Sweetness:4|Fruity:4|Nutty:0|Vegetal:1|Woody:0|Aroma:4|Spicy:0|Floral: 0|Strength:2","Categories>Flavored Tea> Flavored White Tea","",""
"TIINN-0001-02","Iced Tea 6 Count ","<h3>Description</h3> <p>One gallon classic black iced tea bag. 6 count pouch.  UniqTeas Iced Tea 6 Count  is a wonderful iced tea.  UniqTeas.com is a great place to shop for tea and buy tea and tea accessories.</p><h3>Ingredients</h3> <p>Nilgiri black tea</p>","5","Select Iced Tea 6 Count  and other black iced teas at UniqTeas.com for all of your loose tea, tea sachet, tea bag and tea accessory needs.","Iced Tea,Iced Tea 6 Count ,black","698318840","727197546","20000","","Categories>Iced Tea","",""
"TIINN-0002-02","Apricot Iced Tea 6 Count ","<h3>Description</h3> <p>One gallon classic black iced tea bag with apricot flavoring. 6 count pouch.  UniqTeas Apricot Iced Tea 6 Count  is a wonderful iced tea.  UniqTeas.com is a great place to shop for tea and buy tea and tea accessories.</p><h3>Ingredients</h3> <p>Nilgiri black tea with apricot flavoring.</p>","5","Select Apricot Iced Tea 6 Count  and other apricot iced teas at UniqTeas.com for all of your loose tea, tea sachet, tea bag and tea accessory needs.","Iced Tea,Apricot Iced Tea 6 Count ,apricot","698318840","727197546","20000","","Categories>Iced Tea","",""
"TIINN-0003-02","Black Currant Iced Tea 6 Count ","<h3>Description</h3> <p>One gallon classic black iced tea bag with black currant flavoring.  6 count pouch.  UniqTeas Black Currant Iced Tea 6 Count  is a wonderful iced tea.  UniqTeas.com is a great place to shop for tea and buy tea and tea accessories.</p><h3>Ingredients</h3> <p>Nilgiri black tea with mango flavoring.</p>","5","Select Black Currant Iced Tea 6 Count  and other currant iced teas at UniqTeas.com for all of your loose tea, tea sachet, tea bag and tea accessory needs.","Iced Tea,Black Currant Iced Tea 6 Count ,currant","698318840","727197546","20000","","Categories>Iced Tea","",""
"TIINN-0004-02","Mango Iced Tea 6 Count ","<h3>Description</h3> <p>One gallon classic black iced tea bag with mango flavoring.  6 count pouch.  UniqTeas Mango Iced Tea 6 Count  is a wonderful iced tea.  UniqTeas.com is a great place to shop for tea and buy tea and tea accessories.</p><h3>Ingredients</h3> <p>Nilgiri black tea with mango flavoring.</p>","5","Select Mango Iced Tea 6 Count  and other mango iced teas at UniqTeas.com for all of your loose tea, tea sachet, tea bag and tea accessory needs.","Iced Tea,Mango Iced Tea 6 Count ,mango","698318840","727197546","20000","","Categories>Iced Tea","",""
"TIINN-0005-02","Passionfruit Iced Tea 6 Count ","<h3>Description</h3> <p>One gallon classic black iced tea bag with passionfruit flavoring.  6 count pouch.  UniqTeas Passionfruit Iced Tea 6 Count  is a wonderful iced tea.  UniqTeas.com is a great place to shop for tea and buy tea and tea accessories.</p><h3>Ingredients</h3> <p>Nilgiri black tea with passion-fruit flavoring.</p>","5","Select Passionfruit Iced Tea 6 Count  and other passion fruit iced teas at UniqTeas.com for all of your loose tea, tea sachet, tea bag and tea accessory needs.","Iced Tea,Passionfruit Iced Tea 6 Count ,passion fruit","698318840","727197546","20000","","Categories>Iced Tea","",""
"TIINN-0006-02","Raspberry Iced Tea 6 Count ","<h3>Description</h3> <p>One gallon classic black iced tea bag with raspberry flavoring.  6 count pouch.  UniqTeas Raspberry Iced Tea 6 Count  is a wonderful iced tea.  UniqTeas.com is a great place to shop for tea and buy tea and tea accessories.</p><h3>Ingredients</h3> <p>Nilgiri black tea with raspberry flavoring.</p>","5","Select Raspberry Iced Tea 6 Count  and other raspberry iced teas at UniqTeas.com for all of your loose tea, tea sachet, tea bag and tea accessory needs.","Iced Tea,Raspberry Iced Tea 6 Count ,raspberry","698318840","727197546","20000","","Categories>Iced Tea","",""
"TIINN-0007-02","Peach Iced Tea 6 Count ","<h3>Description</h3> <p>One gallon classic black iced tea bag with peach flavoring.  6 count pouch.  UniqTeas Peach Iced Tea 6 Count  is a wonderful iced tea.  UniqTeas.com is a great place to shop for tea and buy tea and tea accessories.</p><h3>Ingredients</h3> <p>Nilgiri black tea with peach flavoring.</p>","5","Select Peach Iced Tea 6 Count  and other peach iced teas at UniqTeas.com for all of your loose tea, tea sachet, tea bag and tea accessory needs.","Iced Tea,Peach Iced Tea 6 Count ,peach","698318840","727197546","20000","","Categories>Iced Tea","",""
