SKU,name,description,price,meta_description,meta_keywords,tax_category_id,shipping_category_id,count_on_hand,product_properties,taxons,blendable_taxon_ids,images
"TBVNN-0059","Holiday Spice Tea Loose Leaf Tea","<h3>Description</h3> <p>Black tea, orange peel, apple pieces, almond pieces, cinnamon chips, rose petals with cinnamon, orange spice and orange flavor  UniqTeas Holiday Spice Tea Loose Leaf Tea is a wonderful black tea.  UniqTeas.com is a great place to shop for tea and buy tea and tea accessories.</p><h3>Ingredients</h3> <p>Black tea, orange peel, apple pieces, almond pieces, cinnamon chips, rose petals with cinnamon, orange spice and orange flavor</p>","11.25","Select Holiday Spice Tea Loose Leaf Tea and other Spice Tea black teas at UniqTeas.com for all of your loose tea, tea sachet, tea bag and tea accessory needs.","Black Tea,Holiday Spice Tea Loose Leaf Tea,Spice Tea","698318840","727197546","20000","Sweetness:3|Fruity:4|Nutty:null|Vegetal:0|Woody:0|Aroma:3|Spicy:0|Floral: 0|Strength:null","Categories>Flavored Tea> Flavored Black Tea","",""
"TBCNN-0060","Yunnan Imperial Loose Leaf Tea","<h3>Description</h3> <p>A small stylish leaf style with golden tips. Steeps a sweet and fragrant cup.  UniqTeas Yunnan Imperial Loose Leaf Tea is a wonderful black tea.  UniqTeas.com is a great place to shop for tea and buy tea and tea accessories.</p><h3>Ingredients</h3> <p>Yunnan tea with lots of golden tips.</p>","20.25","Select Yunnan Imperial Loose Leaf Tea and other Yunnan black teas at UniqTeas.com for all of your loose tea, tea sachet, tea bag and tea accessory needs.","Black Tea,Yunnan Imperial Loose Leaf Tea,Yunnan","698318840","727197546","20000","","Categories>China>Black Tea","",""
"TFANN-0001","Blood Orange Loose Leaf Tea","<h3>Description</h3> <p>Rooibos, orange peel, hibiscus, rose-hips, apple pieces, safflowers, and rose petals with orange, vanilla, and lemon flavor.   UniqTeas Blood Orange Loose Leaf Tea is a wonderful fruit tea.  UniqTeas.com is a great place to shop for tea and buy tea and tea accessories.</p><h3>Ingredients</h3> <p>Rooibos, orange peel, hibiscus, rose hips, apple pieces, safflowers, and rose petals with orange, vanilla, and lemon flavor. </p>","18.75","Select Blood Orange Loose Leaf Tea and other Orange fruit teas at UniqTeas.com for all of your loose tea, tea sachet, tea bag and tea accessory needs.","Fruit Tea,Blood Orange Loose Leaf Tea,Orange","698318840","727197546","20000","Sweetness:4|Fruity:3|Nutty:0|Vegetal:0|Woody:0|Aroma:3|Spicy:0|Floral: 0|Strength:3","Categories>Flavored Tea> Flavored Fruit Tea","",""
"TFVNN-0002","Blueberry Morning Loose Leaf Tea","<h3>Description</h3> <p>Like to start your mornings off with a blueberry muffin?  Well, fruit tea tastes just like one.  Accents of a high-bush blueberry, slightly sweet, rounded out with the slightly toasted flavor of a warm baked muffin.  UniqTeas Blueberry Morning Loose Leaf Tea is a wonderful fruit tea.  UniqTeas.com is a great place to shop for tea and buy tea and tea accessories.</p><h3>Ingredients</h3> <p>apple pieces, hibiscus blossoms, rose hip peels, caramel pieces, flavoring, freeze-dried yoghurt and blueberry pieces, mallow blossoms</p>","16.9","Select Blueberry Morning Loose Leaf Tea and other Blueberry fruit teas at UniqTeas.com for all of your loose tea, tea sachet, tea bag and tea accessory needs.","Fruit Tea,Blueberry Morning Loose Leaf Tea,Blueberry","698318840","727197546","20000","Sweetness:4|Fruity:3|Nutty:0|Vegetal:0|Woody:0|Aroma:3|Spicy:0|Floral: 0|Strength:3","Categories>Flavored Tea> Flavored Fruit Tea","",""
"TFANN-0003","Peach Cardinal Loose Leaf Tea","<h3>Description</h3> <p>Elderberries, hibiscus, apple pieces, papaya cubes, currants, rose hip peels, flavoring, black currants, bilberries, freeze-dried strawberry pieces, cornflower petals.  With all that you might ask why this is called Peach Cardinal, but just try it and you'll see why.  UniqTeas Peach Cardinal Loose Leaf Tea is a wonderful fruit tea.  UniqTeas.com is a great place to shop for tea and buy tea and tea accessories.</p><h3>Ingredients</h3> <p>Elderberries, hibiscus, apple pieces, papaya cubes, currants, rose hip peels, flavoring, black currants, bilberries, freeze-dried strawberry pieces, cornflower petals.</p>","16.6","Select Peach Cardinal Loose Leaf Tea and other Peach fruit teas at UniqTeas.com for all of your loose tea, tea sachet, tea bag and tea accessory needs.","Fruit Tea,Peach Cardinal Loose Leaf Tea,Peach","698318840","727197546","20000","Sweetness:4|Fruity:3|Nutty:0|Vegetal:0|Woody:0|Aroma:3|Spicy:0|Floral: 0|Strength:3","Categories>Flavored Tea> Flavored Fruit Tea","",""
"TFVNN-0004","Roasted Almond Loose Leaf Tea","<h3>Description</h3> <p>This festive fruit tisane is great all year round.  Sweet roasted, caramelized almonds, apples, and beetroot sprinkled with cinnamon make this a delectable favorite.  UniqTeas Roasted Almond Loose Leaf Tea is a wonderful fruit tea.  UniqTeas.com is a great place to shop for tea and buy tea and tea accessories.</p><h3>Ingredients</h3> <p>Apples, Almonds, Cinnamon, and Beet Root pieces.</p>","16.45","Select Roasted Almond Loose Leaf Tea and other Almond fruit teas at UniqTeas.com for all of your loose tea, tea sachet, tea bag and tea accessory needs.","Fruit Tea,Roasted Almond Loose Leaf Tea,Almond","698318840","727197546","20000","Sweetness:4|Fruity:3|Nutty:0|Vegetal:0|Woody:0|Aroma:3|Spicy:0|Floral: 0|Strength:3","Categories>Flavored Tea> Flavored Fruit Tea","",""
"TFVNN-0005","Thank You Berry Much Loose Leaf Tea","<h3>Description</h3> <p>A delightful blend of natural fruits jam packed with sweetness without any added sugar.  All natural, caffeine free, and simply delectable.   UniqTeas Thank You Berry Much Loose Leaf Tea is a wonderful fruit tea.  UniqTeas.com is a great place to shop for tea and buy tea and tea accessories.</p><h3>Ingredients</h3> <p>Elderberries, hibiscus, apple pieces, black currants, flavoring, freeze-dried blackberry, strawberry and raspberry pieces, wild strawberry leaves.</p>","17.8","Select Thank You Berry Much Loose Leaf Tea and other Berry Tea fruit teas at UniqTeas.com for all of your loose tea, tea sachet, tea bag and tea accessory needs.","Fruit Tea,Thank You Berry Much Loose Leaf Tea,Berry Tea","698318840","727197546","20000","Sweetness:4|Fruity:5|Nutty:0|Vegetal:0|Woody:0|Aroma:4|Spicy:0|Floral: 0|Strength:3","Categories>Flavored Tea> Flavored Fruit Tea","",""
"TFVNN-0006","Two Fruits and a Nut Loose Leaf Tea","<h3>Description</h3> <p>Cherries, Kiwis, and almonds!  Who dreamed this one up?  Who cares, it's so delicious you can be thankful anyway.  UniqTeas Two Fruits and a Nut Loose Leaf Tea is a wonderful fruit tea.  UniqTeas.com is a great place to shop for tea and buy tea and tea accessories.</p><h3>Ingredients</h3> <p>Cherry pieces, kiwi pieces, and coconut slivers.</p>","20.75","Select Two Fruits and a Nut Loose Leaf Tea and other cherry, kiwi, coconut fruit teas at UniqTeas.com for all of your loose tea, tea sachet, tea bag and tea accessory needs.","Fruit Tea,Two Fruits and a Nut Loose Leaf Tea,cherry, kiwi, coconut","698318840","727197546","20000","Sweetness:4|Fruity:3|Nutty:0|Vegetal:0|Woody:0|Aroma:3|Spicy:0|Floral: 0|Strength:3","Categories>Flavored Tea> Flavored Fruit Tea","",""
"TFVNN-0007","Fruitini Loose Leaf Tea","<h3>Description</h3> <p>Pineapple, mango, orange, and Strawberry.  UniqTeas Fruitini Loose Leaf Tea is a wonderful fruit tea.  UniqTeas.com is a great place to shop for tea and buy tea and tea accessories.</p><h3>Ingredients</h3> <p>pineapple cubes (pineapple, sugar), mango cubes (mango, sugar), pineapple and mango flakes, orange slices, flavoring, freeze-dried tangerine-orange pieces, safflower, marigold blossoms, freeze-dried strawberry slices.</p>","24.85","Select Fruitini Loose Leaf Tea and other pineapple, mango, orange, strawberry fruit teas at UniqTeas.com for all of your loose tea, tea sachet, tea bag and tea accessory needs.","Fruit Tea,Fruitini Loose Leaf Tea,pineapple, mango, orange, strawberry","698318840","727197546","20000","","Categories>Flavored Tea> Flavored Fruit Tea","",""
"TFVNN-0008","Orange Colada Loose Leaf Tea","<h3>Description</h3> <p>pineapple, apple, hibiscus blossoms, rose hip peel, orange peel, coconut chips, freeze-dried sour cherry, flavoring.  UniqTeas Orange Colada Loose Leaf Tea is a wonderful fruit tea.  UniqTeas.com is a great place to shop for tea and buy tea and tea accessories.</p><h3>Ingredients</h3> <p>pineapple, apple, hibiscus blossoms, rose hip peel, orange peel, coconut chips, freeze-dried sour cherry, flavoring.</p>","17.8","Select Orange Colada Loose Leaf Tea and other pineapple, orange, colada fruit teas at UniqTeas.com for all of your loose tea, tea sachet, tea bag and tea accessory needs.","Fruit Tea,Orange Colada Loose Leaf Tea,pineapple, orange, colada","698318840","727197546","20000","Sweetness:4|Fruity:3|Nutty:0|Vegetal:0|Woody:0|Aroma:4|Spicy:0|Floral: 0|Strength:3","Categories>Flavored Tea> Flavored Fruit Tea","",""
"TFVNN-0009","Pear Cinnamon Loose Leaf Tea","<h3>Description</h3> <p>apple pieces, hibiscus blossoms, rose hip peel, pineapple cubes, cinnamon pieces, flavoring, sunflower blossoms  UniqTeas Pear Cinnamon Loose Leaf Tea is a wonderful fruit tea.  UniqTeas.com is a great place to shop for tea and buy tea and tea accessories.</p><h3>Ingredients</h3> <p>apple pieces, hibiscus blossoms, rose hip peel, pineapple cubes, cinnamon pieces, flavoring, sunflower blossoms</p>","13.5","Select Pear Cinnamon Loose Leaf Tea and other apple, pear, cinnamon fruit teas at UniqTeas.com for all of your loose tea, tea sachet, tea bag and tea accessory needs.","Fruit Tea,Pear Cinnamon Loose Leaf Tea,apple, pear, cinnamon","698318840","727197546","20000","Sweetness:4|Fruity:3|Nutty:0|Vegetal:0|Woody:0|Aroma:3|Spicy:2|Floral: 0|Strength:3","Categories>Flavored Tea> Flavored Fruit Tea","",""
"TGJON-0001","Bancha Loose Leaf Tea","<h3>Description</h3> <p>This fine-grade, surprisingly aromatic bancha has a light golden color, and a slightly vegetal, sweetish aroma   UniqTeas Bancha Loose Leaf Tea is a wonderful green tea.  UniqTeas.com is a great place to shop for tea and buy tea and tea accessories.</p><h3>Ingredients</h3> <p>Bancha tea.</p>","18.75","Select Bancha Loose Leaf Tea and other japanese green teas at UniqTeas.com for all of your loose tea, tea sachet, tea bag and tea accessory needs.","Green Tea,Bancha Loose Leaf Tea,japanese","698318840","727197546","20000","","Categories>Japan","",""
"TGCON-0002","Cherry Sakura Loose Leaf Tea","<h3>Description</h3> <p>Fresh Sencha green tea flavored with ripe summer cherries produce a candied cherry aroma with juicy texture and slightly dry finish.  Perfectly balanced.  A Japanese favorite tea.  UniqTeas Cherry Sakura Loose Leaf Tea is a wonderful green tea.  UniqTeas.com is a great place to shop for tea and buy tea and tea accessories.</p><h3>Ingredients</h3> <p>Sencha, safflowers, and cherry fruit and cherry flavor .</p>","23.25","Select Cherry Sakura Loose Leaf Tea and other Cherry, Sencha green teas at UniqTeas.com for all of your loose tea, tea sachet, tea bag and tea accessory needs.","Green Tea,Cherry Sakura Loose Leaf Tea,Cherry, Sencha","698318840","727197546","20000","Sweetness:3|Fruity:3|Nutty:0|Vegetal:3|Woody:0|Aroma:3|Spicy:0|Floral: 0|Strength:3","Categories>Flavored Tea> Flavored Green Tea","",""
"TGCNN-0003","Chinese Sencha Loose Leaf Tea","<h3>Description</h3> <p>This high-quality, vitalizing Sencha has a pleasantly vegetal aroma and a smooth aftertaste.  It has a rich and brothy texture that rounds out nicely on your palate.  Perfect for green tea lovers.  UniqTeas Chinese Sencha Loose Leaf Tea is a wonderful green tea.  UniqTeas.com is a great place to shop for tea and buy tea and tea accessories.</p><h3>Ingredients</h3> <p>Chinese sencha.</p>","16.5","Select Chinese Sencha Loose Leaf Tea and other chinese green teas at UniqTeas.com for all of your loose tea, tea sachet, tea bag and tea accessory needs.","Green Tea,Chinese Sencha Loose Leaf Tea,chinese","698318840","727197546","20000","","Categories>China>Green Tea","",""
"TGCON-0004","Citrus Green Loose Leaf Tea","<h3>Description</h3> <p>A mild but sweet green tea, you’ll taste the tang of orange, the zing of ginger, and the sweetness of peaches.  Add to that the fragrance of safflower and you have a healthy green tea with an abundance of flavor.  UniqTeas Citrus Green Loose Leaf Tea is a wonderful green tea.  UniqTeas.com is a great place to shop for tea and buy tea and tea accessories.</p><h3>Ingredients</h3> <p>Green tea with orange peel, ginger, peaches, and safflower.</p>","15.75","Select Citrus Green Loose Leaf Tea and other Orange, Ginger, Peach green teas at UniqTeas.com for all of your loose tea, tea sachet, tea bag and tea accessory needs.","Green Tea,Citrus Green Loose Leaf Tea,Orange, Ginger, Peach","698318840","727197546","20000","","Categories>Flavored Tea> Flavored Green Tea","",""
"TGJNN-0005","Genmai-cha Loose Leaf Tea","<h3>Description</h3> <p>A popular japanese tea made from the twigs of the tea bush. upon harvesting, the twigs are roasted four times, turning them nut-brown in color. when infused they yield a mild cup with a nutty/woody aroma. kukicha is low in caffeine and reputed to have relaxing properties   UniqTeas Genmai-cha Loose Leaf Tea is a wonderful green tea.  UniqTeas.com is a great place to shop for tea and buy tea and tea accessories.</p><h3>Ingredients</h3> <p>bancha green tea, popped corn and toasted hulled rice kernels. </p>","18.75","Select Genmai-cha Loose Leaf Tea and other genmaicha green teas at UniqTeas.com for all of your loose tea, tea sachet, tea bag and tea accessory needs.","Green Tea,Genmai-cha Loose Leaf Tea,genmaicha","698318840","727197546","20000","Sweetness:0|Fruity:0|Nutty:2|Vegetal:2|Woody:0|Aroma:2|Spicy:0|Floral: 0|Strength:3","Categories>Japan","",""
"TGVNN-0006","Green Chai Loose Leaf Tea","<h3>Description</h3> <p>If you like Chai and you like green tea, well, meet this great Kashmiri Green Chai tea.  Cinnamon chips, almonds, cloves, crushed green cardamom, and cardamom seeds with almond produce a unique but lovely Chai.  Great with honey or agave.  UniqTeas Green Chai Loose Leaf Tea is a wonderful green tea, chai tea.  UniqTeas.com is a great place to shop for tea and buy tea and tea accessories.</p><h3>Ingredients</h3> <p>Green tea, cinnamon chips, almonds, cloves, crushed green cardamom, and cardamom seeds with almond and cinnamon flavor </p>","17.25","Select Green Chai Loose Leaf Tea and other chai green tea, chai teas at UniqTeas.com for all of your loose tea, tea sachet, tea bag and tea accessory needs.","Green Tea, Chai Tea,Green Chai Loose Leaf Tea,chai","698318840","727197546","20000","","Categories>Flavored Tea> Flavored Green Tea|Categories>Chai Tea","",""
"TGJNN-0007","Green Kukicha Loose Leaf Tea","<h3>Description</h3> <p>Kukicha. A collection of green tea twigs. Kukicha is known as twig tea.    UniqTeas Green Kukicha Loose Leaf Tea is a wonderful green tea.  UniqTeas.com is a great place to shop for tea and buy tea and tea accessories.</p><h3>Ingredients</h3> <p>A collection of green tea twigs. </p>","20.25","Select Green Kukicha Loose Leaf Tea and other kukicha green teas at UniqTeas.com for all of your loose tea, tea sachet, tea bag and tea accessory needs.","Green Tea,Green Kukicha Loose Leaf Tea,kukicha","698318840","727197546","20000","","Categories>Japan","",""
"TGVNN-0008","Green Mango Tango Loose Leaf Tea","<h3>Description</h3> <p>Juicy ripened mango flavor, lemons, and citrus, all fused with a fine Pan fired green tea send this great tea right to your tummy with lots of yummy.  UniqTeas Green Mango Tango Loose Leaf Tea is a wonderful green tea.  UniqTeas.com is a great place to shop for tea and buy tea and tea accessories.</p><h3>Ingredients</h3> <p>Pan fired green tea, marigolds, lemon peel, mango bits, safflowers, mango and citrus flavor </p>","18.75","Select Green Mango Tango Loose Leaf Tea and other mango Tea green teas at UniqTeas.com for all of your loose tea, tea sachet, tea bag and tea accessory needs.","Green Tea,Green Mango Tango Loose Leaf Tea,mango Tea","698318840","727197546","20000","","Categories>Flavored Tea> Flavored Green Tea","",""
"TGCON-0010","Jasmine Loose Leaf Tea","<h3>Description</h3> <p>A light refreshing cup of tea with a slightly roasted profile, notes of silky sweetness, and the delicate infusion of jasmine flowers.  UniqTeas Jasmine Loose Leaf Tea is a wonderful green tea.  UniqTeas.com is a great place to shop for tea and buy tea and tea accessories.</p><h3>Ingredients</h3> <p>100%  Chinese Jasmine</p>","12.75","Select Jasmine Loose Leaf Tea and other chinese green teas at UniqTeas.com for all of your loose tea, tea sachet, tea bag and tea accessory needs.","Green Tea,Jasmine Loose Leaf Tea,chinese","698318840","727197546","20000","Sweetness:2|Fruity:0|Nutty:0|Vegetal:3|Woody:0|Aroma:4|Spicy:0|Floral: 4|Strength:3","Categories>China>Green Tea","",""
"TGCON-0011","Jasmine Pearls Loose Leaf Tea","<h3>Description</h3> <p>Only the youngest leaf tips are scented eight to ten times with jasmine blossoms and hand-rolled into pellets. when infused, the pellets slowly unfold, releasing a delicate, slightly sweet and floral flavor   UniqTeas Jasmine Pearls Loose Leaf Tea is a wonderful green tea.  UniqTeas.com is a great place to shop for tea and buy tea and tea accessories.</p><h3>Ingredients</h3> <p>Chinese jasmine tea pearls.</p>","39","Select Jasmine Pearls Loose Leaf Tea and other chinese green teas at UniqTeas.com for all of your loose tea, tea sachet, tea bag and tea accessory needs.","Green Tea,Jasmine Pearls Loose Leaf Tea,chinese","698318840","727197546","20000","","Categories>China>Green Tea","",""
"TGJON-0012","Kukicha Roasted Loose Leaf Tea","<h3>Description</h3> <p>A popular japanese tea made from the twigs of the tea bush. upon harvesting, the twigs are roasted four times, turning them nut-brown in color. when infused they yield a mild cup with a nutty/woody aroma. kukicha is low in caffeine and reputed to have relaxing properties   UniqTeas Kukicha Roasted Loose Leaf Tea is a wonderful green tea.  UniqTeas.com is a great place to shop for tea and buy tea and tea accessories.</p><h3>Ingredients</h3> <p>Roasted tea twigs and stems. </p>","30.75","Select Kukicha Roasted Loose Leaf Tea and other kukicha green teas at UniqTeas.com for all of your loose tea, tea sachet, tea bag and tea accessory needs.","Green Tea,Kukicha Roasted Loose Leaf Tea,kukicha","698318840","727197546","20000","","Categories>Japan","",""
"TGVNN-0013","Lemongrass Sencha Loose Leaf Tea","<h3>Description</h3> <p>The addition of lemongrass to this perennial Asian favorite makes for an interesting brew. the bright flavor of sencha is balanced with a hint of citrus, making this tea perfect for dining or any time you need to wake up your palate   UniqTeas Lemongrass Sencha Loose Leaf Tea is a wonderful green tea.  UniqTeas.com is a great place to shop for tea and buy tea and tea accessories.</p><h3>Ingredients</h3> <p>Pan fired green tea, lemongrass, safflowers, peach pieces, peach and lemon flavoring </p>","18.75","Select Lemongrass Sencha Loose Leaf Tea and other chinese green teas at UniqTeas.com for all of your loose tea, tea sachet, tea bag and tea accessory needs.","Green Tea,Lemongrass Sencha Loose Leaf Tea,chinese","698318840","727197546","20000","","Categories>Flavored Tea> Flavored Green Tea","",""
"TGJNN-0014","Matcha Loose Leaf Tea","<h3>Description</h3> <p>Powdered green tea from Japan.  It's like drinking 10 cups of green tea.  So healthy.  UniqTeas Matcha Loose Leaf Tea is a wonderful green tea.  UniqTeas.com is a great place to shop for tea and buy tea and tea accessories.</p><h3>Ingredients</h3> <p>Japanese matcha.</p>","69","Select Matcha Loose Leaf Tea and other japanese green teas at UniqTeas.com for all of your loose tea, tea sachet, tea bag and tea accessory needs.","Green Tea,Matcha Loose Leaf Tea,japanese","698318840","727197546","20000","","Categories>Japan","",""
"TGJNN-0014A","Matcha 1 oz. Tin","<h3>Description</h3> <p>Powdered green tea from Japan in 1 oz tin.  UniqTeas Matcha 1 oz. Tin is a wonderful green tea.  UniqTeas.com is a great place to shop for tea and buy tea and tea accessories.</p><h3>Ingredients</h3> <p>Japanese matcha.</p>","8.1","Select Matcha 1 oz. Tin and other japanese green teas at UniqTeas.com for all of your loose tea, tea sachet, tea bag and tea accessory needs.","Green Tea,Matcha 1 oz. Tin,japanese","698318840","727197546","20000","","Categories>Japan","",""
"TGJNN-0014B","Matcha 2 oz. Tin","<h3>Description</h3> <p>Powdered green tea from Japan in 2 oz tin.  UniqTeas Matcha 2 oz. Tin is a wonderful green tea.  UniqTeas.com is a great place to shop for tea and buy tea and tea accessories.</p><h3>Ingredients</h3> <p>Japanese matcha.</p>","12.35","Select Matcha 2 oz. Tin and other japanese green teas at UniqTeas.com for all of your loose tea, tea sachet, tea bag and tea accessory needs.","Green Tea,Matcha 2 oz. Tin,japanese","698318840","727197546","20000","","Categories>Japan","",""
"TGCON-0015","Mintea Loose Leaf Tea","<h3>Description</h3> <p>A choice green tea sprinkled with Moroccan peppermint that leaves your mouth with that fresh cool feeling only mint can give.  Makes a delightful iced tea too.  UniqTeas Mintea Loose Leaf Tea is a wonderful green tea.  UniqTeas.com is a great place to shop for tea and buy tea and tea accessories.</p><h3>Ingredients</h3> <p>Green tea with peppermint leaves.</p>","12.75","Select Mintea Loose Leaf Tea and other Mint green teas at UniqTeas.com for all of your loose tea, tea sachet, tea bag and tea accessory needs.","Green Tea,Mintea Loose Leaf Tea,Mint","698318840","727197546","20000","Sweetness:2|Fruity:0|Nutty:0|Vegetal:2|Woody:0|Aroma:3|Spicy:0|Floral: 0|Strength:3","Categories>Flavored Tea> Flavored Green Tea","",""
"TGVNN-0016","Moroccan Jasmine Mint Loose Leaf Tea","<h3>Description</h3> <p>If you're a fan of classic Moroccan mint tea, the unique and delightful addition of jasmine will make you wonder where this tea has been all your life.  The marriage of mint and jasmine seem to be destined to remain an all time favorite.  UniqTeas Moroccan Jasmine Mint Loose Leaf Tea is a wonderful green tea.  UniqTeas.com is a great place to shop for tea and buy tea and tea accessories.</p><h3>Ingredients</h3> <p>Jasmine tea with peppermint leaves.</p>","15.4","Select Moroccan Jasmine Mint Loose Leaf Tea and other chinese green teas at UniqTeas.com for all of your loose tea, tea sachet, tea bag and tea accessory needs.","Green Tea,Moroccan Jasmine Mint Loose Leaf Tea,chinese","698318840","727197546","20000","","Categories>Flavored Tea> Flavored Green Tea","",""
"TGCON-0017","Gunpowder Loose Leaf Tea","<h3>Description</h3> <p>Each tea leaf is singly hand-rolled into tiny, tight pellets, gently cracking the membranes inside the tea leaf. when infused, there is a near instant release of the tea's liquor. the infusion is light, aromatic, and complex with a flowery undertone   UniqTeas Gunpowder Loose Leaf Tea is a wonderful green tea.  UniqTeas.com is a great place to shop for tea and buy tea and tea accessories.</p><h3>Ingredients</h3> <p>Chinese organic gunpowder tea.</p>","9.75","Select Gunpowder Loose Leaf Tea and other chinese green teas at UniqTeas.com for all of your loose tea, tea sachet, tea bag and tea accessory needs.","Green Tea,Gunpowder Loose Leaf Tea,chinese","698318840","727197546","20000","Sweetness:0|Fruity:0|Nutty:0|Vegetal:4|Woody:0|Aroma:1|Spicy:0|Floral: 0|Strength:null","Categories>China>Green Tea","",""
"TGCON-0018","Jasmine Green Loose Leaf Tea","<h3>Description</h3> <p>A wonderful, light and flowery green tea.  Infused with fragrant jasmine this green is delicate and does not over-steep.    UniqTeas Jasmine Green Loose Leaf Tea is a wonderful green tea.  UniqTeas.com is a great place to shop for tea and buy tea and tea accessories.</p><h3>Ingredients</h3> <p>Organic chinese jasmine tea.</p>","19.5","Select Jasmine Green Loose Leaf Tea and other chinese green teas at UniqTeas.com for all of your loose tea, tea sachet, tea bag and tea accessory needs.","Green Tea,Jasmine Green Loose Leaf Tea,chinese","698318840","727197546","20000","","Categories>China>Green Tea","",""
"TGCON-0019","Precious Eyebrow Loose Leaf Tea","<h3>Description</h3> <p>This high-grade chun mee (or ""precious eyebrow"") has a distinct plum-like essence. smooth and sweet.  Once steeped,it delivers a mild, smooth plumminess to the cup.  An approachable, easy tea that is ideal as a daily treat.  UniqTeas Precious Eyebrow Loose Leaf Tea is a wonderful green tea.  UniqTeas.com is a great place to shop for tea and buy tea and tea accessories.</p><h3>Ingredients</h3> <p>Organic chinese green tea.</p>","10.5","Select Precious Eyebrow Loose Leaf Tea and other chinese green teas at UniqTeas.com for all of your loose tea, tea sachet, tea bag and tea accessory needs.","Green Tea,Precious Eyebrow Loose Leaf Tea,chinese","698318840","727197546","20000","","Categories>China>Green Tea","",""
