SKU,name,description,price,meta_description,meta_keywords,tax_category_id,shipping_category_id,count_on_hand,product_properties,taxons,blendable_taxon_ids,images
"TBVNN-0001","Almond Loose Leaf Tea","<h3>Description</h3> <p>Uniq tea Almond black tea starts with a full-leaf black tea blended with decadent almond pieces and raw almond extract that creates a plush mouthfeel reminiscent of creamy marzipan with a clean balanced astringency and a nutty finish.  UniqTeas Almond Loose Leaf Tea is a wonderful black tea.  UniqTeas.com is a great place to shop for tea and buy tea and tea accessories.</p><h3>Ingredients</h3> <p>safflowers, peppermint, licorice, tulsi, sambuca flavor</p>","11.25","Select Almond Loose Leaf Tea and other Almond black teas at UniqTeas.com for all of your loose tea, tea sachet, tea bag and tea accessory needs.","Black Tea,Almond Loose Leaf Tea,Almond","698318840","727197546","20000","Sweetness:3|Fruity:0|Nutty:5|Vegetal:0|Woody:0|Aroma:4|Spicy:0|Floral: 0|Strength:3","Categories>Flavored Tea> Flavored Black Tea","",""
"TBINN-0002","Antu Valley Estate Nepali Tea Loose Leaf Tea","<h3>Description</h3> <p>Uniq Teas Antu Valley Estate Nepali Loose Leaf Tea originates from the leaves of the esteemed Nepal tea Antu Valley Estate. Uniq Teas Antu Valley Estate Nepali Tea is a highly caffeinated tea with a hint of citrus fruit. Known for its exceptionally smooth and sweet finish. Experience the natural flavors and premium taste of Uniq Teas for a quality cup of tea.   UniqTeas Antu Valley Estate Nepali Tea Loose Leaf Tea is a wonderful black tea.  UniqTeas.com is a great place to shop for tea and buy tea and tea accessories.</p><h3>Ingredients</h3> <p>Nepali black tea from the Antu Valley Estate</p>","23.25","Select Antu Valley Estate Nepali Tea Loose Leaf Tea and other nepali black teas at UniqTeas.com for all of your loose tea, tea sachet, tea bag and tea accessory needs.","Black Tea,Antu Valley Estate Nepali Tea Loose Leaf Tea,nepali","698318840","727197546","20000","","Categories>India","",""
"TBCNN-0003","Apricot Brandy Loose Leaf Tea","<h3>Description</h3> <p>Uniq Teas Apricot Brandy Loose Leaf Tea sweetens your cup of tea with its unique blend of tangy black tea and delicious fruit. Making delightful afternoon or dessert tea, Uniq Teas Apricot Brandy Tea takes the natural sweetness of the apricot and is finished with a hint of spiced brandy. Uniq Teas Apricot Brady has a fragrant aroma for a memorable experience.   UniqTeas Apricot Brandy Loose Leaf Tea is a wonderful black tea.  UniqTeas.com is a great place to shop for tea and buy tea and tea accessories.</p><h3>Ingredients</h3> <p>Black tea and apricot pieces with apricot brandy flavor </p>","12.75","Select Apricot Brandy Loose Leaf Tea and other apricot black teas at UniqTeas.com for all of your loose tea, tea sachet, tea bag and tea accessory needs.","Black Tea,Apricot Brandy Loose Leaf Tea,apricot","698318840","727197546","20000","","Categories>Flavored Tea> Flavored Black Tea","",""
"TBINN-0004","Assam Harmutty Loose Leaf Tea","<h3>Description</h3> <p>Uniq Teas Assam Harmutty Loose Leaf Tea is a full-bodied black tea with a fruity and malty aroma. Originating from the prestigious Harmutty tea estate, Uniq Teas Assam Harmutty Tea provides an earthy blend with a hint of honey. Typically is served along with a splash of milk or sugar.  UniqTeas Assam Harmutty Loose Leaf Tea is a wonderful black tea.  UniqTeas.com is a great place to shop for tea and buy tea and tea accessories.</p><h3>Ingredients</h3> <p>Assam tea from Harmutty Tea Estate.</p>","18","Select Assam Harmutty Loose Leaf Tea and other assam black teas at UniqTeas.com for all of your loose tea, tea sachet, tea bag and tea accessory needs.","Black Tea,Assam Harmutty Loose Leaf Tea,assam","698318840","727197546","20000","","Categories>India","",""
"TBINN-0005","Assam Meleng Loose Leaf Tea","<h3>Description</h3> <p>Uniq Teas Assam Meleng Loose Leaf Tea is a brisk and pungent black tea flavor and a fruity, wine-scented aroma. Uniq Teas Assam Meleng Tea infuses its golden brown tea leaves into a malty cup of tea with a bit of an aftertaste. Delivering a memorable taste to your cup of tea.   UniqTeas Assam Meleng Loose Leaf Tea is a wonderful black tea.  UniqTeas.com is a great place to shop for tea and buy tea and tea accessories.</p><h3>Ingredients</h3> <p>Assam tea from Meleng Tea Estate.</p>","18","Select Assam Meleng Loose Leaf Tea and other assam black teas at UniqTeas.com for all of your loose tea, tea sachet, tea bag and tea accessory needs.","Black Tea,Assam Meleng Loose Leaf Tea,assam","698318840","727197546","20000","","Categories>India","",""
"TBIOF-0006","Assam Loose Leaf Tea","<h3>Description</h3> <p>Uniq Teas Assam Loose Leaf Tea presents a brisk and pungent black tea flavor. Uniq Teas Assam Assam Tea infuses its golden brown tea leaves into a malty cup of tea with a bit of an aftertaste. Delivering a memorable taste to your cup of tea, Uniq Teas Assam is a great full bodied tea.   UniqTeas Assam Loose Leaf Tea is a wonderful black tea.  UniqTeas.com is a great place to shop for tea and buy tea and tea accessories.</p><h3>Ingredients</h3> <p>Whole leaf Assam tea.</p>","9.75","Select Assam Loose Leaf Tea and other Assam black teas at UniqTeas.com for all of your loose tea, tea sachet, tea bag and tea accessory needs.","Black Tea,Assam Loose Leaf Tea,Assam","698318840","727197546","20000","Sweetness:2|Fruity:0|Nutty:0|Vegetal:0|Woody:0|Aroma:2|Spicy:0|Floral: 0|Strength:5","Categories>India","",""
"TBCNN-0007","Berried Treasure Loose Leaf Tea","<h3>Description</h3> <p>Uniq tea Black tea loose tea is loaded with black currant, and black currant leaves with black currant, huckleberry, and blackberry flavor.  Very refreshing and delicious.    UniqTeas Berried Treasure Loose Leaf Tea is a wonderful black tea.  UniqTeas.com is a great place to shop for tea and buy tea and tea accessories.</p><h3>Ingredients</h3> <p>Black tea, black currant, and black currant leaves with black currant, huckleberry, and blackberry flavor </p>","12","Select Berried Treasure Loose Leaf Tea and other Berry Tea black teas at UniqTeas.com for all of your loose tea, tea sachet, tea bag and tea accessory needs.","Black Tea,Berried Treasure Loose Leaf Tea,Berry Tea","698318840","727197546","20000","","Categories>Flavored Tea> Flavored Black Tea","",""
"TBVNN-0008","Black Chai Loose Leaf Tea","<h3>Description</h3> <p>Uniq tea Black Chai Loose Tea brews a full-flavored and spicy cup of quality chai tea.Chai Tea is a blend of dark Indian black teas and spices such as ginger, cinnamon, cloves, cardamom, star anise as natural sweeteners. Uniq Teas Black Chai Tea is a full bodied cupa tea.   UniqTeas Black Chai Loose Leaf Tea is a wonderful black tea, chai tea.  UniqTeas.com is a great place to shop for tea and buy tea and tea accessories.</p><h3>Ingredients</h3> <p>Black tea , ginger root, cinnamon, green cardamom and cinnamon, ginger and vanilla flavor  </p>","12.75","Select Black Chai Loose Leaf Tea and other Black Chai black tea, chai teas at UniqTeas.com for all of your loose tea, tea sachet, tea bag and tea accessory needs.","Black Tea, Chai Tea,Black Chai Loose Leaf Tea,Black Chai","698318840","727197546","20000","Sweetness:2|Fruity:0|Nutty:0|Vegetal:0|Woody:0|Aroma:4|Spicy:5|Floral: 0|Strength:4","Categories>Flavored Tea> Flavored Black Tea|Categories>Chai Tea","",""
"TBVNN-0009","Black Currant Loose Leaf Tea","<h3>Description</h3> <p>Uniq Teas Currant loose tea offers an aromatic jammy currants infused flavor in a full-bodied black tea.  You can drink it hot in the winter or iced in the summer, either way it's a delicious tea that's a favorite across the world.  UniqTeas Black Currant Loose Leaf Tea is a wonderful black tea.  UniqTeas.com is a great place to shop for tea and buy tea and tea accessories.</p><h3>Ingredients</h3> <p>Black tea with black currant pieces, black currant leaves, and black currant flavor </p>","11.25","Select Black Currant Loose Leaf Tea and other Black Currant black teas at UniqTeas.com for all of your loose tea, tea sachet, tea bag and tea accessory needs.","Black Tea,Black Currant Loose Leaf Tea,Black Currant","698318840","727197546","20000","Sweetness:3|Fruity:4|Nutty:0|Vegetal:0|Woody:0|Aroma:3|Spicy:0|Floral: 0|Strength:null","Categories>Flavored Tea> Flavored Black Tea","",""
"TBVNN-0010","Caramelicious Loose Leaf Tea","<h3>Description</h3> <p>Uniq Teas is Caramel or Carmel full-leaf black tea with decadent pieces of caramel accompany the dark caramel aroma, and brown sugar notes. Dense and decadent cup, with a sweet, molasses aftertaste. (contains dairy)    UniqTeas Caramelicious Loose Leaf Tea is a wonderful black tea.  UniqTeas.com is a great place to shop for tea and buy tea and tea accessories.</p><h3>Ingredients</h3> <p>Black tea with caramel flavor </p>","11.25","Select Caramelicious Loose Leaf Tea and other Caramel black teas at UniqTeas.com for all of your loose tea, tea sachet, tea bag and tea accessory needs.","Black Tea,Caramelicious Loose Leaf Tea,Caramel","698318840","727197546","20000","Sweetness:4|Fruity:0|Nutty:2|Vegetal:0|Woody:0|Aroma:3|Spicy:0|Floral: 0|Strength:4","Categories>Flavored Tea> Flavored Black Tea","",""
"TBSNN-0011","Ceylon Kenilworth Loose Leaf Tea","<h3>Description</h3> <p>Uniq Teas Ceylon Kenilworth Loose Leaf Tea infuses a soft, rose-like scent.With its black tea blend and fruity aroma, Uniq Teas Ceylon Kenilworth Tea is known as a comfort tea. Uniq Teas Ceylon Kenilworth Tea infuses a deep-red color for a delicate look and taste. Uniq Teas is a freat place to shop for tea and buy tea.   UniqTeas Ceylon Kenilworth Loose Leaf Tea is a wonderful black tea.  UniqTeas.com is a great place to shop for tea and buy tea and tea accessories.</p><h3>Ingredients</h3> <p>Ceylon tea from Kenilworth Estate.</p>","12","Select Ceylon Kenilworth Loose Leaf Tea and other Ceylon black teas at UniqTeas.com for all of your loose tea, tea sachet, tea bag and tea accessory needs.","Black Tea,Ceylon Kenilworth Loose Leaf Tea,Ceylon","698318840","727197546","20000","","Categories>Sri Lanka","",""
"TBVNN-0012","Coco Moca Chai Loose Leaf Tea","<h3>Description</h3> <p>Uniq Teas Chocolate Chai Black Tea is a rich decadent chocolate tea and combined it with the exotic flavors and spices of Masala Chai to create the terrific treat. Chocolate flavored Ceylon black tea blended with cardamom, ginger, cloves, cinnamon. Soothing spicy cocoa notes, zesty, warming quality and soft liquid chocolate texture.    UniqTeas Coco Moca Chai Loose Leaf Tea is a wonderful black tea, chai tea.  UniqTeas.com is a great place to shop for tea and buy tea and tea accessories.</p><h3>Ingredients</h3> <p>Black tea , ginger root, green cardamom, chocolate chips and chocolate flavor </p>","12.75","Select Coco Moca Chai Loose Leaf Tea and other Chocolate Coconut Chai black tea, chai teas at UniqTeas.com for all of your loose tea, tea sachet, tea bag and tea accessory needs.","Black Tea, Chai Tea,Coco Moca Chai Loose Leaf Tea,Chocolate Coconut Chai","698318840","727197546","20000","","Categories>Flavored Tea> Flavored Black Tea|Categories>Chai Tea","",""
"TBVNN-0013","Chocolate Cream Loose Leaf Tea","<h3>Description</h3> <p>Uniq Teas Chocolate Cream Loose Leaf Tea delights with indulgent flavors of black tea, cocoa and chocolate bits. For a rich and decadent taste, Uniq Teas Chocolate Cream Tea stays sweet as real chocolate chips melt into a full-bodied Ceylon black tea. Transporting you to your favorite chocolate dessert, Uniq Teas is a great place to shop for teas and buy tea.   UniqTeas Chocolate Cream Loose Leaf Tea is a wonderful black tea.  UniqTeas.com is a great place to shop for tea and buy tea and tea accessories.</p><h3>Ingredients</h3> <p>Black tea and chocolate pieces with chocolate flavor </p>","11.25","Select Chocolate Cream Loose Leaf Tea and other Chocolate black teas at UniqTeas.com for all of your loose tea, tea sachet, tea bag and tea accessory needs.","Black Tea,Chocolate Cream Loose Leaf Tea,Chocolate","698318840","727197546","20000","","Categories>Flavored Tea> Flavored Black Tea","",""
"TBVNN-0014","Coconut Loose Leaf Tea","<h3>Description</h3> <p>Uniq Teas coconut black loose tea can is sweet and savory like coconut. Few teas can play with other flavors quite as seamlessly as classic Ceylon black tea. In one cup, you'll get the dense, creamy texture of fresh coconut with the balanced brightness and tang of Ceylon. Perfectly sweet and rich, warm, toasty nutty aroma, soft finish.    UniqTeas Coconut Loose Leaf Tea is a wonderful black tea.  UniqTeas.com is a great place to shop for tea and buy tea and tea accessories.</p><h3>Ingredients</h3> <p>Black tea with shredded coconut and coconut flavor </p>","11.25","Select Coconut Loose Leaf Tea and other Coconut black teas at UniqTeas.com for all of your loose tea, tea sachet, tea bag and tea accessory needs.","Black Tea,Coconut Loose Leaf Tea,Coconut","698318840","727197546","20000","Sweetness:3|Fruity:0|Nutty:3|Vegetal:0|Woody:0|Aroma:4|Spicy:0|Floral: 0|Strength:4","Categories>Flavored Tea> Flavored Black Tea","",""
"TBVNN-0015","Coconut Chai Loose Leaf Tea","<h3>Description</h3> <p>Uniq Teas Coconut Chai Loose Leaf  Black tea is a sweet delightful blend of, ginger root, cinnamon, shredded coconut, ginger, coconut and vanilla flavor. The coconut plays off the chai to create a sweet and sav ory tea that is creamy and sweet. Good with sugar and milk.    UniqTeas Coconut Chai Loose Leaf Tea is a wonderful black tea, chai tea.  UniqTeas.com is a great place to shop for tea and buy tea and tea accessories.</p><h3>Ingredients</h3> <p>Black tea , ginger root, cinnamon, shredded coconut, ginger, coconut and vanilla flavor. </p>","12.75","Select Coconut Chai Loose Leaf Tea and other Coconut, Chai black tea, chai teas at UniqTeas.com for all of your loose tea, tea sachet, tea bag and tea accessory needs.","Black Tea, Chai Tea,Coconut Chai Loose Leaf Tea,Coconut, Chai","698318840","727197546","20000","","Categories>Flavored Tea> Flavored Black Tea|Categories>Chai Tea","",""
"TBVNN-0016","Decaf. English Breakfast Loose Leaf Tea","<h3>Description</h3> <p>Uniq Teas Black Loose decafinated English Breakfast tea is ust as tasty as our fine English Breakfast blend, just without the caffeine.  Try it with or without milk.  You'll love it either way. Uniq teas is a great place to shop for teas and buy teas.   UniqTeas Decaf. English Breakfast Loose Leaf Tea is a wonderful black tea, decaffeinated tea.  UniqTeas.com is a great place to shop for tea and buy tea and tea accessories.</p><h3>Ingredients</h3> <p>Decaf Assam, decaf Nilgiri</p>","18","Select Decaf. English Breakfast Loose Leaf Tea and other Decaffeinated Tea black tea, decaffeinated teas at UniqTeas.com for all of your loose tea, tea sachet, tea bag and tea accessory needs.","Black Tea, Decaffeinated Tea,Decaf. English Breakfast Loose Leaf Tea,Decaffeinated Tea","698318840","727197546","20000","","Categories>Flavored Tea> Flavored Black Tea|Categories>Decaf Tea","",""
"TBVNN-0017","Earl Grey Loose Leaf Tea","<h3>Description</h3> <p>Uniq Teas Earl Grey loose leaf  tea is a fine blend of black tea with the zesty and fragrant aroma of top quality Bergamot oil.  A classic black tea loved across the world. Uniq Teas Earl Grey Loose Leaf Tea delivers a timeless and classic tea with its rich, full-bodied black tea taste and exotic citrus flavor. For a refined exquisite  taste and memorable aroma, Uniq Teas Earl Grey Tea infuses the citrus punch of the bergamot fruit. A refreshing and bright cup of tea for anytime of your day,    UniqTeas Earl Grey Loose Leaf Tea is a wonderful black tea.  UniqTeas.com is a great place to shop for tea and buy tea and tea accessories.</p><h3>Ingredients</h3> <p>Whole leaf Black tea, bergamot flavor. </p>","11.25","Select Earl Grey Loose Leaf Tea and other Bergamot black teas at UniqTeas.com for all of your loose tea, tea sachet, tea bag and tea accessory needs.","Black Tea,Earl Grey Loose Leaf Tea,Bergamot","698318840","727197546","20000","Sweetness:2|Fruity:2|Nutty:0|Vegetal:0|Woody:0|Aroma:5|Spicy:0|Floral: 0|Strength:5","Categories>Flavored Tea> Flavored Black Tea","",""
"TBVNN-0018","Earl Grey Citrus Loose Leaf Tea","<h3>Description</h3> <p>Uniq Teas Earl Grey Citrus loose leaf  tea is a fine blend of black tea with the zesty and fragrant aroma of top quality Bergamot oil and citrus.  A classic black tea loved across the world. Uniq Teas Earl Grey Loose Leaf Tea delivers a timeless and classic tea with its rich, full-bodied black tea taste and exotic exta citrus flavor. For a refined exquisite  taste and memorable aroma, Uniq Teas Earl Grey Citrus Tea infuses the citrus punch of the bergamot fruit. A refreshing and bright cup of tea for anytime of your day,    UniqTeas Earl Grey Citrus Loose Leaf Tea is a wonderful black tea.  UniqTeas.com is a great place to shop for tea and buy tea and tea accessories.</p><h3>Ingredients</h3> <p>Whole leaf black tea with citrus and premium bergamot. </p>","13.5","Select Earl Grey Citrus Loose Leaf Tea and other Bergamot black teas at UniqTeas.com for all of your loose tea, tea sachet, tea bag and tea accessory needs.","Black Tea,Earl Grey Citrus Loose Leaf Tea,Bergamot","698318840","727197546","20000","","Categories>Flavored Tea> Flavored Black Tea","",""
"TBVNN-0019","Earl Grey de la Crème Loose Leaf Tea","<h3>Description</h3> <p>One of our top teas this whole leaf black tea has a premium bergamot oil but adds vanilla to give it smooth creaminess. Uniq Teas Earl Grey De La Creme loose leaf  tea is a fine blend of black tea with the zesty and fragrant aroma of top quality Bergamot oil and vanilla.  A classic black tea loved across the world. Uniq Teas Earl Grey De La creme Loose Leaf Tea delivers a timeless and classic tea with its rich, full-bodied black tea taste and exotic citrus flavor. For a refined exquisite  taste and memorable aroma, Uniq Teas Earl Grey De La Creme Tea infuses the citrus punch of the bergamot fruit and softned with vanilla.  A refreshing and bright cup of tea for anytime of your day,    UniqTeas Earl Grey de la Crème Loose Leaf Tea is a wonderful black tea.  UniqTeas.com is a great place to shop for tea and buy tea and tea accessories.</p><h3>Ingredients</h3> <p>Whole leaf black tea with vanilla and premium bergamot. </p>","13.5","Select Earl Grey de la Crème Loose Leaf Tea and other Bergamot black teas at UniqTeas.com for all of your loose tea, tea sachet, tea bag and tea accessory needs.","Black Tea,Earl Grey de la Crème Loose Leaf Tea,Bergamot","698318840","727197546","20000","","Categories>Flavored Tea> Flavored Black Tea","",""
"TBVNN-0020","English Breakfast Loose Leaf Tea","<h3>Description</h3> <p>Uniq teas English Breakfast Tea is a blend of strong Indian teas with the malty flavor of Assam. The original, classic cup of English Breakfast was made with black Indian.  Across many generations, plenty of different interpretations have been made. Our English Breakfast is close to what the customer has come to expect from an English Brekfast.    UniqTeas English Breakfast Loose Leaf Tea is a wonderful black tea.  UniqTeas.com is a great place to shop for tea and buy tea and tea accessories.</p><h3>Ingredients</h3> <p>A blend of Keemun and Assam black tea.</p>","11.25","Select English Breakfast Loose Leaf Tea and other Breakfast black teas at UniqTeas.com for all of your loose tea, tea sachet, tea bag and tea accessory needs.","Black Tea,English Breakfast Loose Leaf Tea,Breakfast","698318840","727197546","20000","","Categories>Flavored Tea> Flavored Black Tea","",""
"TBVNN-0021","Five O'Clock Tea Loose Leaf Tea","<h3>Description</h3> <p>Uniq Teas Five O'Clock tea has less caffine and is  medium-bodied tea.This Black tea is an aromatic blend of Darjeeling, highland Ceylon, and oolong, This infusion has a sparkling golden-amber cup color and a fruity-citrus flavor (and yes, we do offer it at every other hour as well).     UniqTeas Five O'Clock Tea Loose Leaf Tea is a wonderful black tea.  UniqTeas.com is a great place to shop for tea and buy tea and tea accessories.</p><h3>Ingredients</h3> <p>Blend of Chinese and Indian teas.</p>","17.25","Select Five O'Clock Tea Loose Leaf Tea and other Evening Tea black teas at UniqTeas.com for all of your loose tea, tea sachet, tea bag and tea accessory needs.","Black Tea,Five O'Clock Tea Loose Leaf Tea,Evening Tea","698318840","727197546","20000","","Categories>Flavored Tea> Flavored Black Tea","",""
"TBVNN-0022","Georgia Ginger Peach Loose Leaf Tea","<h3>Description</h3> <p>Uniq Teas Georgia Ginger Peach Black Loose Leaf tea has become an American classic. Georgia  Ginger Peach Black has the soft warmth of ginger with the sweet depth of summer ripe peaches and apricots, paired beautifully with tangy, naturally citrusy black tea. Enjoyable anytime of year as a hot tea, we find it to be particularly refreshing iced.     UniqTeas Georgia Ginger Peach Loose Leaf Tea is a wonderful black tea.  UniqTeas.com is a great place to shop for tea and buy tea and tea accessories.</p><h3>Ingredients</h3> <p>Black tea, ginger root, and peach pieces with ginger flavor </p>","12","Select Georgia Ginger Peach Loose Leaf Tea and other Ginger Peach Tea black teas at UniqTeas.com for all of your loose tea, tea sachet, tea bag and tea accessory needs.","Black Tea,Georgia Ginger Peach Loose Leaf Tea,Ginger Peach Tea","698318840","727197546","20000","","Categories>Flavored Tea> Flavored Black Tea","",""
"TBVNN-0023","Grand Earl Grey Loose Leaf Tea","<h3>Description</h3> <p>Uniq Teas Grand Earl Grey loose leaf  tea is a fine blend of black tea with the zesty and fragrant aroma of top quality Bergamot oil.  A classic black tea loved across the world. Uniq TeasGrand Earl Grey Loose Leaf  Tea delivers a timeless and classic tea with its rich, full-bodied black tea taste and exotic citrus flavor. For a refined exquisite  taste and memorable aroma, Uniq Teas Grand Earl Grey Tea infuses the citrus punch of the bergamot fruit. A refreshing and bright cup of tea for anytime of your day,    UniqTeas Grand Earl Grey Loose Leaf Tea is a wonderful black tea.  UniqTeas.com is a great place to shop for tea and buy tea and tea accessories.</p><h3>Ingredients</h3> <p>Grand Keemun Tea with premium beramot and a sprinkle of white Yin Zhen tea.</p>","19.5","Select Grand Earl Grey Loose Leaf Tea and other Bergamot black teas at UniqTeas.com for all of your loose tea, tea sachet, tea bag and tea accessory needs.","Black Tea,Grand Earl Grey Loose Leaf Tea,Bergamot","698318840","727197546","20000","","Categories>Flavored Tea> Flavored Black Tea","",""
"TBCNN-0024","Grand Keemun Loose Leaf Tea","<h3>Description</h3> <p>Uniq Teas Grand Keemun Black Loose Leaf  tea from the province of China. Perhaps the most famous of Chinese varieties, prized for its rich, toasty flavor, mineral flinty notes and smoky, almost incense aroma. Our Grand Keemun steeps a beautiful, fiery amber red, with a smoky aroma and earthy, smooth flavor.   UniqTeas Grand Keemun Loose Leaf Tea is a wonderful black tea.  UniqTeas.com is a great place to shop for tea and buy tea and tea accessories.</p><h3>Ingredients</h3> <p>Chinese keemun tea.</p>","18.75","Select Grand Keemun Loose Leaf Tea and other Keemun black teas at UniqTeas.com for all of your loose tea, tea sachet, tea bag and tea accessory needs.","Black Tea,Grand Keemun Loose Leaf Tea,Keemun","698318840","727197546","20000","","Categories>China>Black Tea","",""
"TBVNN-0025","Irish Breakfast Loose Leaf Tea","<h3>Description</h3> <p>Uniq Teas Irish Breakfast Black Loose Leaf  Tea is a combination  of hearty black teas from China and India to get your morning off to a bright start. As its name implies, Irish Breakfast tea is an ideal accompaniment to a morning meal. It is a strong tea that has a malty underscore of a pungent Assam. Spicy and jammy aroma on the leaf, malty and deep flavor with a brisk and bold feel. Rounded sweetness in the finish.    UniqTeas Irish Breakfast Loose Leaf Tea is a wonderful black tea.  UniqTeas.com is a great place to shop for tea and buy tea and tea accessories.</p><h3>Ingredients</h3> <p>Blend of chinese and Indian teas.</p>","12","Select Irish Breakfast Loose Leaf Tea and other Breakfast black teas at UniqTeas.com for all of your loose tea, tea sachet, tea bag and tea accessory needs.","Black Tea,Irish Breakfast Loose Leaf Tea,Breakfast","698318840","727197546","20000","","Categories>Flavored Tea> Flavored Black Tea","",""
"TBCNN-0026","Keemun Imperial Loose Leaf Tea","<h3>Description</h3> <p>Uniq Teas Keemun Imperial Black Loose Leaf  tea from the province of China. Perhaps the most famous of Chinese varieties, prized for its rich, toasty flavor, mineral flinty notes and smoky, almost incense aroma. Our Keemun Imperial  steeps a beautiful, fiery amber red, with a smoky aroma and earthy, smooth flavor.   UniqTeas Keemun Imperial Loose Leaf Tea is a wonderful black tea.  UniqTeas.com is a great place to shop for tea and buy tea and tea accessories.</p><h3>Ingredients</h3> <p>Chinese keemun tea.</p>","14.25","Select Keemun Imperial Loose Leaf Tea and other Keemun black teas at UniqTeas.com for all of your loose tea, tea sachet, tea bag and tea accessory needs.","Black Tea,Keemun Imperial Loose Leaf Tea,Keemun","698318840","727197546","20000","","Categories>China>Black Tea","",""
